{
    "schemaVersion":  "1.1.0",
    "artifactId":  "04910716-cf11-422e-bbd4-e1dcb1b934d1",
    "kind":  "architecture-report",
    "relativePath":  "artifacts/quality/architecture-report.json",
    "sha256":  "dddddddddddddddddddddddddddddddddddddddddddddddddddddddddddddddd",
    "producer":  {
                     "gateRunId":  "0bf24249-38e7-4495-bcd5-87dac51ac8e6",
                     "gateId":  "G-ARCH"
                 },
    "source":  {
                   "commitSha":  "743cc5baf94f39d910f53cfd7c0876785ae83041",
                   "sourceTreeHash":  "aaaaaaaaaaaaaaaaaaaaaaaaaaaaaaaaaaaaaaaaaaaaaaaaaaaaaaaaaaaaaaaa",
                   "dirty":  false
               },
    "inputFingerprints":  {
                              "source":  "aaaaaaaaaaaaaaaaaaaaaaaaaaaaaaaaaaaaaaaaaaaaaaaaaaaaaaaaaaaaaaaa",
                              "policy":  "bbbbbbbbbbbbbbbbbbbbbbbbbbbbbbbbbbbbbbbbbbbbbbbbbbbbbbbbbbbbbbbb"
                          },
    "tool":  {
                 "name":  "architecture-audit",
                 "version":  "1.0.0"
             },
    "environment":  {
                        "operatingSystem":  "windows",
                        "architecture":  "x64",
                        "nodeVersion":  "22.12.0",
                        "timezone":  "UTC"
                    },
    "generatedAt":  "2026-08-08T12:00:03Z",
    "freshness":  {
                      "policyId":  "release-evidence-24h",
                      "maxAgeHours":  24,
                      "validUntil":  "2026-08-09T12:00:03Z"
                  },
    "decision":  "pass",
    "waiverIds":  [

                  ],
    "normalized":  true,
    "containsSecrets":  false,
    "sensitivity":  "internal",
    "redactions":  0
}
